[
  {
    "finding_id": "FND-0001",
    "title": "国庆第四日到店量与进店质量随门店形态/场景分化，选址可见性是结构约束",
    "statement": "国庆第四日各店到店情境分化：遵义播州客流与往常相当、看 LS8/L6 比例上升；重庆新光里商超以饭后带小孩闲逛为主；万州万达客流与昨日相当、部分客户因调性驻足且门店位置好、人流大。同时贵阳万象汇反馈门店位置不佳、很难找。",
    "pattern_ids": [
      "PAT-0001",
      "PAT-0016"
    ],
    "convergence_ids": [
      "CONV-0001",
      "CONV-0016"
    ],
    "issue_ids": [
      "ISS-0001",
      "ISS-0016"
    ],
    "confidence": "low",
    "business_implication": "到店量受门店形态、选址可见性与到店场景主导，等客到店效率有限；把路过/闲逛型客流转为深度体验，需要场景化动作与选址可见性专项改善。",
    "recommended_action": "汇总可复制的到店转化动作（亲子体验、静态卖点展示）；对位置难找/可见性差的门店做专项引导与招牌改善；建立到店场景与客群结构的日常记录。",
    "priority": "P2",
    "boundary": "到店情境 4 条证据跨 3 店、选址 1 条单店，均为单日定性自报；未与客流计数/转化数据归因。",
    "status": "ready",
    "owner": "产品 / 销售运营",
    "created_at": "2026-10-04"
  },
  {
    "finding_id": "FND-0002",
    "title": "产品力与一线服务获正向认可，是可复用的转化基础",
    "statement": "多店正向反馈：LS8 慢闪集客强、大空间留资约七成；试驾后舒适性配置齐全；LS6 配置同级最全；用户认可双 6 颜值；龙虾/副驾屏对亲子客户效果好；L6 联名版吸睛。同时主理与销售队伍获评专业高效。",
    "pattern_ids": [
      "PAT-0002",
      "PAT-0018"
    ],
    "convergence_ids": [
      "CONV-0002",
      "CONV-0018"
    ],
    "issue_ids": [
      "ISS-0002",
      "ISS-0018"
    ],
    "confidence": "low",
    "business_implication": "产品优势项与良好的一线服务是当前转化的确定性抓手，应固化为标准动作而非依赖个体。",
    "recommended_action": "将已验证的产品展示与销售话术（配置完整、亲子体验、联名版）沉淀为门店标准动作；延续对一线服务的正向反馈机制。",
    "priority": "P3",
    "boundary": "产品优势 6 条跨 6 店、服务 2 条跨 2 店，均为单日定性自报；未与成交/锁单数据归因。",
    "status": "ready",
    "owner": "产品 / 销售运营",
    "created_at": "2026-10-04"
  },
  {
    "finding_id": "FND-0003",
    "title": "价格与纯电续航关注仍是短期决策焦点",
    "statement": "遵义播州用户核心关注价格及纯电续航；重庆新光里 L6 用户认为竞品没有太明显的、主要看价格。",
    "pattern_ids": [
      "PAT-0003"
    ],
    "convergence_ids": [
      "CONV-0003"
    ],
    "issue_ids": [
      "ISS-0003"
    ],
    "confidence": "low",
    "business_implication": "价格与续航预期未被清晰回应时，用户容易停留在观望；需要标准化的价格/续航口径与对比解释。",
    "recommended_action": "准备价格与纯电续航的标准应答与竞品对比口径；结合节日权益把价格保护讲清楚。",
    "priority": "P1",
    "boundary": "2 条证据跨 2 店、单日定性自报；为价格关注信号，不等同于实际退单或流失。",
    "status": "ready",
    "owner": "产品 / 销售运营",
    "created_at": "2026-10-04"
  },
  {
    "finding_id": "FND-0004",
    "title": "非刚需与弱意向客群拉长决策周期、稀释到店质量",
    "statement": "LS6 年轻客户关注多但更不愿留资、倾向自行了解；贵阳万象汇客户体验后直接离店、整体意向度不高；另一反馈强意向客户明显减少。",
    "pattern_ids": [
      "PAT-0009"
    ],
    "convergence_ids": [
      "CONV-0009"
    ],
    "issue_ids": [
      "ISS-0009"
    ],
    "confidence": "low",
    "business_implication": "非刚需客群占比上升会拉长决策周期并稀释到店质量，需要在店内设计强制深度体验与留资钩子。",
    "recommended_action": "针对年轻/非刚需客群设计深度体验动线与留资激励；用高意向信号（预约试驾、再次到店）区分资源投入。",
    "priority": "P2",
    "boundary": "3 条证据跨 3 店、单日；为意向度观察，未与留资/锁单数据归因。",
    "status": "ready",
    "owner": "产品 / 销售运营",
    "created_at": "2026-10-04"
  },
  {
    "finding_id": "FND-0005",
    "title": "竞品差距集中在情绪价值、内饰质感与个性化便利配置",
    "statement": "用户将 LS6 外观与小米 YU7 对比、被 JimmyChoo 内饰蓝色吸引并期待选装、认为功能体验不如理想 i6 情绪价值、认为理想内饰质感不错，并主动询问抬头显示（HUD）。",
    "pattern_ids": [
      "PAT-0011",
      "PAT-0012",
      "PAT-0013"
    ],
    "convergence_ids": [
      "CONV-0011",
      "CONV-0012",
      "CONV-0013"
    ],
    "issue_ids": [
      "ISS-0011",
      "ISS-0012",
      "ISS-0013"
    ],
    "confidence": "low",
    "business_implication": "情绪价值、内饰质感与便利配置是可被用户直接感知的差异化点，缺失会形成对比劣势。",
    "recommended_action": "评估专属内饰色/选装与个性化套件；把内饰质感与情绪价值纳入门店演示脚本；评估 HUD 等便利配置的诉求与配置策略。",
    "priority": "P2",
    "boundary": "情绪价值 4 条跨 3 店、内饰质感 1 条、HUD 1 条，单日；未记录对比具体车型与细分差异，不能量化对锁单的影响。",
    "status": "ready",
    "owner": "产品 / 销售运营",
    "created_at": "2026-10-04"
  },
  {
    "finding_id": "FND-0006",
    "title": "智舱语音/大模型体验与雨刮-智驾联动是可用性短板",
    "statement": "用户希望车机大模型响应更快、吐槽语音功能不稳定；重庆礼嘉天街反馈雨刮速度快或小雨偶发快速刮时智驾无法及时打开。",
    "pattern_ids": [
      "PAT-0005",
      "PAT-0017"
    ],
    "convergence_ids": [
      "CONV-0005",
      "CONV-0017"
    ],
    "issue_ids": [
      "ISS-0005",
      "ISS-0017"
    ],
    "confidence": "low",
    "business_implication": "智舱响应/稳定性与雨天智驾可用性会直接影响功能卖点的现场体验，需核实并优先处理。",
    "recommended_action": "收集语音与大模型响应的具体场景并同步产品；核实雨刮-智驾联锁逻辑，明确雨天智驾开启条件并给出销售解释口径。",
    "priority": "P2",
    "boundary": "语音 2 条跨 2 店、雨刮-智驾 1 条，单日；无法判断根因，不能作为质量缺陷结论。",
    "status": "ready",
    "owner": "产品 / 销售运营",
    "created_at": "2026-10-04"
  },
  {
    "finding_id": "FND-0007",
    "title": "品牌曝光与本地化沟通仍是到店与留资约束",
    "statement": "一线建议加强线上传播提高品牌与门店知名度、提升品牌曝光吸引主动到店；贵阳万象汇反馈外地专家听不懂方言、客户不切普通话而离开，建议按员工家乡分配专家。",
    "pattern_ids": [
      "PAT-0007",
      "PAT-0015"
    ],
    "convergence_ids": [
      "CONV-0007",
      "CONV-0015"
    ],
    "issue_ids": [
      "ISS-0007",
      "ISS-0015"
    ],
    "confidence": "low",
    "business_implication": "品牌曝光不足与本地化沟通未适配会同时削弱主动到店与到店后的留资转化。",
    "recommended_action": "延续线上传播与品牌曝光投入；在门店排班上考虑员工家乡/方言适配，减少因沟通障碍导致的客户流失。",
    "priority": "P2",
    "boundary": "品牌 2 条跨 2 店、本地化 1 条，单日；未量化对到店与留资的影响。",
    "status": "ready",
    "owner": "产品 / 销售运营",
    "created_at": "2026-10-04"
  },
  {
    "finding_id": "FND-0008",
    "title": "车型人群区隔与家庭品质关注，LS8 纯电版存在需求期待",
    "statement": "偏好 L6 与 LS6 的用户区隔明显（L6 偏女性、LS6 偏家用）；家庭用户关注品质延续性（电池终身质保、高阶智驾免费、商业险价格）；遵义吾悦用户对 LS8 纯电版较为期待。",
    "pattern_ids": [
      "PAT-0010",
      "PAT-0019"
    ],
    "convergence_ids": [
      "CONV-0010",
      "CONV-0019"
    ],
    "issue_ids": [
      "ISS-0010",
      "ISS-0019"
    ],
    "confidence": "low",
    "business_implication": "人群区隔与家庭客群对长期价值的关注，是可运营的差异化抓手；新动力版本排期影响部分用户下单节奏。",
    "recommended_action": "按人群设计差异化演示与话术（L6 女性/LS6 家用）；把质保与长期价值点讲清楚；同步 LS8 纯电版排期以管理用户预期。",
    "priority": "P3",
    "boundary": "人群 4 条跨 2 店、纯电期待 1 条，单日；不能外推为总体车型结构结论。",
    "status": "ready",
    "owner": "产品 / 销售运营",
    "created_at": "2026-10-04"
  },
  {
    "finding_id": "FND-0009",
    "title": "门店运营与陈列动作可优化，老客户转介绍是低成本抓手",
    "statement": "一线建议直播+慢闪引流、设儿童区、明示竞品对标 onepage、资源优先投静态可感知部分、L6 展厅只放腰托；同时建议维护老客户口碑、发动老带新。贵阳万象汇反馈门店强制摆放颈托/头枕导致落座不适、反而抱怨头部空间不够。",
    "pattern_ids": [
      "PAT-0006",
      "PAT-0008",
      "PAT-0014"
    ],
    "convergence_ids": [
      "CONV-0006",
      "CONV-0008",
      "CONV-0014"
    ],
    "issue_ids": [
      "ISS-0006",
      "ISS-0008",
      "ISS-0014"
    ],
    "confidence": "low",
    "business_implication": "可复制的运营与陈列动作、以及老用户转介绍，是相对低成本的进店与转化抓手；不当陈列反而制造负面第一感。",
    "recommended_action": "沉淀标准化引流/物料动作并在门店落地；规范 L6 展厅陈列（去掉影响落座的售后件、只放腰托）；设计老带新/转介绍机制。",
    "priority": "P3",
    "boundary": "运营 5 条跨 5 店、老客户 1 条、陈列 1 条，单日；未验证各动作对进店/转化的实际效果。",
    "status": "ready",
    "owner": "产品 / 销售运营",
    "created_at": "2026-10-04"
  },
  {
    "finding_id": "FND-0010",
    "title": "线控转向卖点传达与付费意愿不足，需强化价值演示",
    "statement": "重庆南岸反馈大部分用户对线控转向没什么感觉、认为可有可无、不太愿意为此配置买单。",
    "pattern_ids": [
      "PAT-0004"
    ],
    "convergence_ids": [
      "CONV-0004"
    ],
    "issue_ids": [
      "ISS-0004"
    ],
    "confidence": "low",
    "business_implication": "线控转向作为卖点若无法在体验中让用户感知价值，就难以转化为配置溢价与下单理由。",
    "recommended_action": "在线控转向试驾/静态演示中设计可感知的价值场景与话术，强化对操控与安全增益的体验传达。",
    "priority": "P3",
    "boundary": "单店单条专家观察、单日；未记录具体驾驶场景差异，不能作为产品缺陷结论。",
    "status": "ready",
    "owner": "产品 / 销售运营",
    "created_at": "2026-10-04"
  }
]
