[
  {
    "finding_id": "FND-0001",
    "title": "多店正向信号可作为一线优势叙事复用",
    "statement": "价格权益、品牌认知、展车陈列、到店客流、车型人群互补、油车置换、服务口碑与性价比等正向信号在多店、多车系同时出现，构成本期可复用的优势叙事。",
    "pattern_ids": ["PAT-0006"],
    "convergence_ids": ["CONV-0006"],
    "issue_ids": ["ISS-0007", "ISS-0008", "ISS-0009"],
    "confidence": "low",
    "business_implication": "在对比竞品与决策周期拉长的背景下，可被用户直接感知的价格权益、显性配置与门店体验是相对确定的抓手。",
    "recommended_action": "将各店已验证的展车陈列、价格权益沟通与服务话术整理为标准动作，供其他门店复用。",
    "priority": "P3",
    "boundary": "正向信号为各店自报、单日定性样本，未与成交/锁单数据做归因，不能量化贡献。",
    "status": "ready",
    "owner": "销售运营 / 市场",
    "created_at": "2026-09-25"
  },
  {
    "finding_id": "FND-0002",
    "title": "L6/LS6 定位与低线城市关注点需重新梳理",
    "statement": "用户反馈 L6 与 LS6 价格接近、L6 价格优势不明显，而低线城市用户更关注显性功能配置，L6 的差异化价值与低线市场沟通重点存在不匹配。",
    "pattern_ids": ["PAT-0001"],
    "convergence_ids": ["CONV-0001"],
    "issue_ids": ["ISS-0001", "ISS-0002"],
    "confidence": "low",
    "business_implication": "同一价格带内的 L6/LS6 内部比较，叠加低线城市对「看得见」配置的偏好，可能削弱 L6 的说服力与分流效率。",
    "recommended_action": "梳理 L6 与 LS6 的价格与配置差异，明确 L6 的差异化卖点与面向低线城市的沟通口径。",
    "priority": "P2",
    "boundary": "2 条证据跨 2 店、1 天，均为定性自报，不代表总体比例或结论。",
    "status": "ready",
    "owner": "产品规划 / 销售培训",
    "created_at": "2026-09-25"
  },
  {
    "finding_id": "FND-0003",
    "title": "竞品价格优势与非刚需叠加，转化更依赖现场引导",
    "statement": "三线城市竞品（零跑）具备价格优势并分流客流，同时用户可选范围广、非刚需占比高、反复对比后再决策，两个信号叠加使转化更依赖现场引导。",
    "pattern_ids": ["PAT-0003", "PAT-0004"],
    "convergence_ids": ["CONV-0003", "CONV-0004"],
    "issue_ids": ["ISS-0003", "ISS-0004"],
    "confidence": "low",
    "business_implication": "在价格敏感且非刚需的低线市场，等待自然转化成本较高，需要更主动的到店引导与对比话术。",
    "recommended_action": "针对价格敏感用户准备竞品对比与权益组合话术，并跟踪非刚需用户的到店跟进转化。",
    "priority": "P2",
    "boundary": "来自遵义、重庆 2 家门店 1 天的自报观察，未获取竞品价格与客流数据，不能外推。",
    "status": "ready",
    "owner": "销售运营 / 渠道",
    "created_at": "2026-09-25"
  },
  {
    "finding_id": "FND-0004",
    "title": "老用户 App 权益削减带来忠诚度维护诉求",
    "statement": "用户反馈手机 App「水晶」权益削减严重并要求增加获取渠道，一线认为老用户产品升级需新增功能以提升品牌忠诚度。",
    "pattern_ids": ["PAT-0005"],
    "convergence_ids": ["CONV-0005"],
    "issue_ids": ["ISS-0005"],
    "confidence": "low",
    "business_implication": "老用户权益与升级体验若被削弱，可能影响复购与转介绍，进而放大品牌信任顾虑。",
    "recommended_action": "复核 App 权益体系的调整影响，评估增加「水晶」获取渠道与老用户功能回馈的方案。",
    "priority": "P3",
    "boundary": "单店单条用户诉求，未量化老用户流失或复购影响。",
    "status": "ready",
    "owner": "用户运营 / App 产品",
    "created_at": "2026-09-25"
  },
  {
    "finding_id": "FND-0005",
    "title": "部分需求等待 LS8 纯电上市",
    "statement": "男性家庭用户大多询问 LS8 纯电上市时间，反映部分需求在等待纯电版本上市后再决策。",
    "pattern_ids": ["PAT-0002"],
    "convergence_ids": ["CONV-0002"],
    "issue_ids": ["ISS-0006"],
    "confidence": "low",
    "business_implication": "若纯电版本上市节奏不明确，相关需求可能持续观望，影响短期转化。",
    "recommended_action": "明确并前置 LS8 纯电上市信息的沟通口径，跟踪等待型需求的转化节奏。",
    "priority": "P3",
    "boundary": "单店单条用户询问；stated intent 不等同于实际锁单/退订行为。",
    "status": "ready",
    "owner": "产品规划 / 市场",
    "created_at": "2026-09-25"
  }
]
