[
  {"finding_id":"FND-0001","title":"新款与价格权益预期使部分用户继续观望","statement":"多个门店提到用户等待老款降价、期待新款上市后的优惠赠配，或反复到店后仍在比较权益；价格确定性是本期反复出现的决策话题。","pattern_ids":["PAT-0001"],"convergence_ids":["CONV-0001"],"issue_ids":["ISS-0001"],"confidence":"medium","business_implication":"当用户担心购后价格变化时，产品比较可能转为等待，延长决策周期。","recommended_action":"统一说明新旧款价格、权益与价格保护边界；对反复到店客户记录等待条件，跟踪后续是否成交。","priority":"P1","boundary":"4 家门店的单日定性记录；没有实际成交或流失数据，不将观望等同于订单损失。","status":"ready","owner":"产品 / 销售运营","created_at":"2026-10-06"},
  {"finding_id":"FND-0002","title":"品牌认知与可信信息仍是门店解释成本","statement":"多个门店报告品牌混淆、用户对品牌持续性存疑；万州一店记录当日 4 组客户误以为智己与华为有关，其中 3 组在听到澄清后离开。","pattern_ids":["PAT-0003"],"convergence_ids":["CONV-0003"],"issue_ids":["ISS-0003"],"confidence":"medium","business_implication":"品牌身份与长期服务承诺如果不易理解，门店需要额外投入时间建立认知，也可能影响部分客户继续体验。","recommended_action":"准备简洁、可核验的品牌归属、企业背景与服务延续性材料；门店观察品牌澄清前后的留店与体验情况。","priority":"P1","boundary":"4 家门店、单日自报；“3 组离开”来自单店观察，未确认离开原因，不外推为品牌认知的普遍流失率。","status":"ready","owner":"品牌 / 销售运营","created_at":"2026-10-06"},
  {"finding_id":"FND-0003","title":"客流规模不等于高意向到店","statement":"一店反馈客流较前期下降且留资意向不高，另一店反馈到店量较大但多数访客以了解信息为主，呈现出流量与意向质量分化。","pattern_ids":["PAT-0004"],"convergence_ids":["CONV-0004"],"issue_ids":["ISS-0004"],"confidence":"low","business_implication":"只看进店人数难以判断门店销售机会，需把来访目的、留资和后续跟进分开记录。","recommended_action":"在客流记录中增加到店目的、留资意向和复访状态；对假期后不同门店的客流变化做连续观察。","priority":"P2","boundary":"仅两店单日文字反馈，统计定义未统一，不用于判断城市客流趋势或假期影响。","status":"ready","owner":"销售运营","created_at":"2026-10-06"},
  {"finding_id":"FND-0004","title":"线控转向的差异点更适合通过试驾建立感知","statement":"两家门店均提到线控转向难以静态呈现；其中一店观察到用户试驾后能感受到与竞品不同的体验。","pattern_ids":["PAT-0005"],"convergence_ids":["CONV-0005"],"issue_ids":["ISS-0005"],"confidence":"medium","business_implication":"若仅依靠静态讲解，技术卖点可能难以转化为用户可感知的体验差异。","recommended_action":"将线控转向说明与试驾路线、试驾前后体验提问结合，收集真实感知反馈并沉淀可复用讲解方式。","priority":"P2","boundary":"两家门店单日观察；未做标准化试驾前后评估，也未验证对成交的影响。","status":"ready","owner":"产品 / 销售运营","created_at":"2026-10-06"},
  {"finding_id":"FND-0005","title":"门店提出的获客动作可整理为小范围验证清单","statement":"一线建议包括老客户转介绍、参与地方车展、增加线上直播和开放式展厅等，覆盖口碑、活动、线上传播与门店空间。","pattern_ids":["PAT-0006"],"convergence_ids":["CONV-0006"],"issue_ids":["ISS-0006"],"confidence":"low","business_implication":"获客建议分属不同渠道，若不记录投入与线索质量，难以判断优先级。","recommended_action":"选择门店先行试点，逐项记录触达、到店、留资和试驾结果，再决定是否复制；单店选址问题单独核查。","priority":"P2","boundary":"4 家门店的建议性反馈，没有执行与效果数据。","status":"ready","owner":"销售运营","created_at":"2026-10-06"},
  {"finding_id":"FND-0006","title":"LS6 配置价值和部分车色获得一线正向反馈","statement":"两家门店分别反馈 LS6 配置完整、适合家庭使用，以及茶色和银色接受度较高。","pattern_ids":["PAT-0007"],"convergence_ids":["CONV-0007"],"issue_ids":["ISS-0007"],"confidence":"low","business_implication":"配置价值和颜色偏好可作为门店讲解与展车观察线索，但仍需结构化数据验证。","recommended_action":"在后续问卷或门店观察中记录颜色关注、实际选配与车型版本，避免用少数口头反馈直接调整生产计划。","priority":"P3","boundary":"两店单日定性反馈；不代表总体用户偏好和实际配置选择。","status":"ready","owner":"产品 / 销售运营","created_at":"2026-10-06"},
  {"finding_id":"FND-0007","title":"竞品比较应拆分到具体体验维度","statement":"当日反馈分别提到特斯拉驾驶感受、座舱智能化，以及极氪 7X 内饰质感和女性用户对 L6 外观的偏好，信号分散在不同维度和个案中。","pattern_ids":["PAT-0008"],"convergence_ids":["CONV-0008"],"issue_ids":["ISS-0008"],"confidence":"low","business_implication":"以笼统的竞品优劣判断组织话术容易掩盖用户真正关注的体验维度。","recommended_action":"竞品对比材料按驾驶、座舱、内饰和外观分别陈列可核实信息；持续收集对应车型、用户场景和原话。","priority":"P3","boundary":"两家门店的少量自报，不代表相关竞品用户总体评价或人群结构。","status":"ready","owner":"产品 / 销售运营","created_at":"2026-10-06"}
]
