[
  {
    "finding_id": "FND-0001",
    "title": "国庆第三日到店量与进店质量随门店形态/选址分化，运营与引流动作是关键",
    "statement": "国庆第三日各店到店情境分化：遵义播州客流平稳约 11 组、关注 LS6/LS8 各四成且多当天预约试驾，重庆金陵车城店 LS6 进店明显增加，部分快闪门店位置优越人流大；但遵义吾悦展点受相邻电竞活动影响、万州快闪第三天客流回落以走马观花为主，且贵阳万象汇门店因拐角盲区、朝向不利和招牌被遮挡难以被找到。与此同时一线在核心竞品对标物料、线上传播、异业互推、进店礼与直播上给出一致动作建议。",
    "pattern_ids": [
      "PAT-0001",
      "PAT-0004",
      "PAT-0015"
    ],
    "convergence_ids": [
      "CONV-0001",
      "CONV-0004",
      "CONV-0015"
    ],
    "issue_ids": [
      "ISS-0001",
      "ISS-0004",
      "ISS-0015"
    ],
    "confidence": "low",
    "business_implication": "到店量受门店形态、选址可见性与外部活动等不可控变量主导，单纯等客到店效率低；可复制的物料与线上/异业动作是把路过型客流转为深度体验的现实抓手，而选址可见性属需专项处理的结构约束。",
    "recommended_action": "汇总可复制的引流物料（竞品对标 one page、易拉宝、车内对标卡）与线上传播动作，按门店形态差异化落地；对拐角盲区/招牌被遮挡门店做专项可见性改善与引导；建立展点外部活动冲突的报备协调机制。",
    "priority": "P2",
    "boundary": "到店情境 7 条证据跨 4 店、运营建议 5 条跨 5 店、选址可见性 2 条同店，均为单日定性自报；未验证各动作对进店/转化的实际效果。",
    "status": "ready",
    "owner": "销售运营 / 市场",
    "created_at": "2026-10-03"
  },
  {
    "finding_id": "FND-0002",
    "title": "产品力与服务获正向认可，家庭多代同堂需求与场景适配值得关注",
    "statement": "多店正向反馈底盘与空间、LS6 家庭适配与性价比、造型与展示色获认可，一线销售团队状态良好；同时贵阳门店到店客户呈现三代同堂、全家出动、家庭单位更大特征（单组可达 7-8 人），需同时满足多年龄段诉求，而重庆山路场景下轿车存在磕底盘顾虑、大部分人仍看 SUV。",
    "pattern_ids": [
      "PAT-0002",
      "PAT-0008"
    ],
    "convergence_ids": [
      "CONV-0002",
      "CONV-0008"
    ],
    "issue_ids": [
      "ISS-0002",
      "ISS-0008"
    ],
    "confidence": "low",
    "business_implication": "产品与服务优势项是可复用的确定性抓手；但在多代同堂家庭场景与山区市场，产品适配与车型定位存在落差，可能影响 LS6/L6 在特定客群的转化。",
    "recommended_action": "将已验证的产品展示与服务话术固化为门店标准动作；针对三代同堂家庭场景提炼空间/座椅/安全卖点话术；对重庆等山路城市补充轿车通过性与底盘卖点的现场体验设计。",
    "priority": "P3",
    "boundary": "产品优势 10 条证据跨 7 店、人群场景 4 条跨 3 店，均为单日定性自报；未与成交/锁单数据做归因，不能外推为总体车型结构结论。",
    "status": "ready",
    "owner": "产品规划 / 销售运营",
    "created_at": "2026-10-03"
  },
  {
    "finding_id": "FND-0003",
    "title": "价格与权益预期是当前短期转化的主要抑制",
    "statement": "重庆南岸客户对产品满意但在价格与权益上希望多争取、销售只能按厂家报价；南坪专家认为降价并非有效方式、LS6 已具性价比但用户仍能找到不满意；贵阳万象汇用户价格敏感、爱讨价还价并属'等等党'，门店缺少有力逼单政策。",
    "pattern_ids": [
      "PAT-0003"
    ],
    "convergence_ids": [
      "CONV-0003"
    ],
    "issue_ids": [
      "ISS-0003"
    ],
    "confidence": "low",
    "business_implication": "在价格与权益预期未被清晰回应时，即使产品与性价比获认可，用户仍容易持续观望；需要标准化的权益口径与可用的临门一脚工具。",
    "recommended_action": "准备节日价格保护/权益与赠品口径的标准应答；评估在合规前提下给一线有限的小额优惠/赠品额度或逼单工具，用于高意向临门一脚客户。",
    "priority": "P1",
    "boundary": "4 条证据跨 3 店、单日定性自报；为价格与权益态度信号，不等同于实际退单或流失，未量化对锁单率的影响。",
    "status": "ready",
    "owner": "销售运营 / 市场",
    "created_at": "2026-10-03"
  },
  {
    "finding_id": "FND-0004",
    "title": "品牌认可度与地域价格定位仍是到店约束",
    "statement": "重庆南坪反馈需提升用户认可度与品牌社交知名度，并建议提升品牌曝光吸引主动到店；万州快闪反馈智己在当地算偏贵车型。",
    "pattern_ids": [
      "PAT-0005"
    ],
    "convergence_ids": [
      "CONV-0005"
    ],
    "issue_ids": [
      "ISS-0005"
    ],
    "confidence": "low",
    "business_implication": "在下沉与快闪场景，品牌认知与价格定位仍会让用户在到店前产生距离感，制约主动到店。",
    "recommended_action": "延续品牌曝光投入并沉淀品牌认知改善素材；针对低线城市准备价格/价值解释与竞品对比口径。",
    "priority": "P2",
    "boundary": "3 条证据跨 2 店、单日；未量化品牌认知或价格定位对到店与转化的影响。",
    "status": "ready",
    "owner": "市场 / 品牌",
    "created_at": "2026-10-03"
  },
  {
    "finding_id": "FND-0005",
    "title": "促销力度与充电/赠品权益相对竞品存在差距",
    "statement": "用户重点关注购车是否免费赠送家充桩，多组客户询问充电桩权益并以此结束探店；贵阳万象汇反馈国庆活动力度不够、竞品试驾有礼品。",
    "pattern_ids": [
      "PAT-0007"
    ],
    "convergence_ids": [
      "CONV-0007"
    ],
    "issue_ids": [
      "ISS-0007"
    ],
    "confidence": "low",
    "business_implication": "充电桩与试驾礼等权益是竞品可直接对比的显性权益，缺少明确口径会让用户在探店末段流失。",
    "recommended_action": "明确充电桩/家充权益的对外口径与门店应答；评估国庆等节点的试驾礼/赠品方案，缩小与竞品的显性权益差距。",
    "priority": "P2",
    "boundary": "4 条证据跨 2 店、单日；为促销与权益差距观察，未量化为流失或转化损失。",
    "status": "ready",
    "owner": "市场 / 销售运营",
    "created_at": "2026-10-03"
  },
  {
    "finding_id": "FND-0006",
    "title": "竞品对标差距集中在智驾品牌认知、情绪价值与个性化设计",
    "statement": "用户认为华为系智驾自带光环、即使表现相近也觉得更好；同时被老款智慧尾灯/半幅方向盘等可表达自我的设计吸引并对被砍失望，希望有类似蔚来 babyblue 的专属车漆，并认为 SU7 内饰更好看。",
    "pattern_ids": [
      "PAT-0010",
      "PAT-0011"
    ],
    "convergence_ids": [
      "CONV-0010",
      "CONV-0011"
    ],
    "issue_ids": [
      "ISS-0010",
      "ISS-0011"
    ],
    "confidence": "low",
    "business_implication": "智驾的竞争不止于能力还在于品牌认知；设计/情绪价值是可被用户直接感知的差异化点，缺失会形成对比劣势。",
    "recommended_action": "梳理智驾与华为系的可感知差异与应答话术；评估专属车漆/个性化套件的可行性；把情绪价值与设计卖点纳入门店演示脚本。",
    "priority": "P2",
    "boundary": "智驾 2 条证据跨 2 店、设计/个性化 3 条跨 2 店，单日；未记录对比具体车型与细分差异点，不能量化对锁单的影响。",
    "status": "ready",
    "owner": "产品市场 / 智驾产品 / 造型设计",
    "created_at": "2026-10-03"
  },
  {
    "finding_id": "FND-0007",
    "title": "产品体验细节待优化：线控体验、后排包裹性、LS8 尾门感应与 L6 储物",
    "statement": "重庆礼嘉天街用户认可底盘但认为线控体验一般、后排座椅包裹性不够；遵义播州反馈 LS8 尾门 KK 需多试两次才能触发打开、存在学习成本；重庆新光里反馈 L6 前后备箱第一感偏小、实用性不高。",
    "pattern_ids": [
      "PAT-0012",
      "PAT-0013",
      "PAT-0014",
      "PAT-0009"
    ],
    "convergence_ids": [
      "CONV-0012",
      "CONV-0013",
      "CONV-0014",
      "CONV-0009"
    ],
    "issue_ids": [
      "ISS-0012",
      "ISS-0013",
      "ISS-0014",
      "ISS-0009"
    ],
    "confidence": "low",
    "business_implication": "这些是可在实车体验中被放大的细节，单点虽弱，但会削弱卖点传达与实用性感知。",
    "recommended_action": "收集线控体验与后排座椅的具体场景反馈并同步产品；优化尾门感应触发逻辑/引导；评估 L6 储物空间的展示与话术，避免第一感劣势。",
    "priority": "P3",
    "boundary": "分别为单条证据的单店观察、单日；无法判断根因，不能作为质量或设计缺陷结论。",
    "status": "ready",
    "owner": "产品工程 / 门店运营",
    "created_at": "2026-10-03"
  },
  {
    "finding_id": "FND-0008",
    "title": "老用户口碑与老带新转介绍是未充分运营的资源",
    "statement": "重庆南坪建议维护老客户口碑、发动老客户带人进店体验。",
    "pattern_ids": [
      "PAT-0006"
    ],
    "convergence_ids": [
      "CONV-0006"
    ],
    "issue_ids": [
      "ISS-0006"
    ],
    "confidence": "low",
    "business_implication": "在价格观望与竞品对比约束下，老用户口碑与转介绍是相对低成本的确定性抓手。",
    "recommended_action": "设计老带新/转介绍机制（如节日老带新试驾活动、老车主口碑传播），并在门店落地。",
    "priority": "P3",
    "boundary": "单店单条建议、单日；未量化为实际转介绍或复购贡献。",
    "status": "ready",
    "owner": "销售运营 / 市场",
    "created_at": "2026-10-03"
  }
]
