[
  {
    "finding_id": "FND-0001",
    "title": "国庆次日到店量受外部情境主导、客流质量分化，引流与转化动作是关键",
    "statement": "国庆次日各店到店量分化明显：交付中心约 15 组且均为高意向、核心门店客流高于昨日；而快闪门店 10/02 较 10/01 减少且以走马观花为主，遵义展点因被电竞舞台遮挡获客较昨日减半，贵阳商超店客流多为外地探亲/异地工作人员、问价后回本地试驾。与此同时一线在版本配置对比物料、线上传播、竞品对标公示上给出较一致诉求。",
    "pattern_ids": ["PAT-0001", "PAT-0003"],
    "convergence_ids": ["CONV-0001", "CONV-0003"],
    "issue_ids": ["ISS-0001", "ISS-0003"],
    "confidence": "low",
    "business_implication": "节日到店量受不可控的外部情境（商场活动、假期客流结构）与门店形态主导，单纯等客到店效率低；可复制的物料与线上动作，是把“走马观花/路过型客流”转为“深度体验”的现实抓手。",
    "recommended_action": "建立门店展点外部活动冲突的报备与协调机制（如吾悦展点遮挡）；汇总可复制的引流物料（版本配置对比页、竞品对标 one page）与线上传播动作，按门店形态差异化落地。",
    "priority": "P2",
    "boundary": "客流情境 7 条证据跨 6 店，运营建议 4 条证据跨 4 店，均为单日定性自报；未验证各动作对进店/转化的实际效果，也未与客流计数做归因。",
    "status": "ready",
    "owner": "销售运营 / 市场",
    "created_at": "2026-10-02"
  },
  {
    "finding_id": "FND-0002",
    "title": "门店旧款展车与物料滞后直接削弱看车体验与留客",
    "statement": "贵阳悦然时光反馈 LS6 展车售出后现陈列旧款、门店物料未更新，影响客户看车积极性；另一专家记录展厅放老款，客户敲前备箱、试电吸门后因是老款错失惊艳留客，很多人一听是老款就不上车，并建议至少把最新款 LS6 放进展厅。",
    "pattern_ids": ["PAT-0012"],
    "convergence_ids": ["CONV-0012"],
    "issue_ids": ["ISS-0012"],
    "confidence": "medium",
    "business_implication": "在产品迭代期，展车新旧与物料状态是可即时干预、直接影响看车体验与留客的前端变量；旧款展车会让 L6 的核心体验点（前备箱、电吸门）无法被感知。",
    "recommended_action": "优先为该店调配最新款 LS6 展车并更新门店物料；建立展车售出后补位的时效机制，避免展位空窗为旧款。",
    "priority": "P1",
    "boundary": "4 条证据集中于贵阳悦然时光单店、单日；为单店观察，不能外推为全网门店展车状态结论。",
    "status": "ready",
    "owner": "门店运营 / 销售运营",
    "created_at": "2026-10-02"
  },
  {
    "finding_id": "FND-0003",
    "title": "竞品智舱语音优势成为 LS6 下单卡点",
    "statement": "用户认为竞品智舱语音（如华为系、理想）相比智己优势明显，并将其视为下单 LS6 的一个卡点。反映智舱语音体验存在可被用户直接感知、并影响购买决策的竞品对标差距。",
    "pattern_ids": ["PAT-0010"],
    "convergence_ids": ["CONV-0010"],
    "issue_ids": ["ISS-0010"],
    "confidence": "low",
    "business_implication": "智舱语音是用户高频交互、易被直接对比的感知点；若不能在与华为系/理想的对比中交代清楚，可能在最终比较中成为流失原因。",
    "recommended_action": "梳理本车智舱语音与华为系/理想的可感知差异点，形成一线应答话术与现场演示脚本；将语音体验纳入门店演示标准动作。",
    "priority": "P2",
    "boundary": "单店单条用户对标原话、单日；未记录对比的具体车型与语音细分差异点，不能量化该卡点对锁单的影响。",
    "status": "ready",
    "owner": "产品市场 / 智舱产品",
    "created_at": "2026-10-02"
  },
  {
    "finding_id": "FND-0004",
    "title": "新老款与纯电排期观望、内部车型纠结共同拉长决策周期",
    "statement": "用户在 LS6 新老款之间犹豫（老款有价格优惠但已出新款又纠结），希望新车覆盖双动力并认为 LS8 纯电更早上市更有赢率；同时 L6 对比 LS6 后被认为性价比不高、两车纠结；重庆南坪亦反馈即便说明权益、完成试驾仍难当场下单。多种选择不确定性共同拉长决策周期。",
    "pattern_ids": ["PAT-0005", "PAT-0006", "PAT-0007", "PAT-0008"],
    "convergence_ids": ["CONV-0005", "CONV-0006", "CONV-0007", "CONV-0008"],
    "issue_ids": ["ISS-0005", "ISS-0006", "ISS-0007", "ISS-0008"],
    "confidence": "low",
    "business_implication": "在车型迭代与动力形式切换期，用户面对新旧款、动力形式与内部车型的多重选择，容易转为观望；缺少清晰的选择引导会持续拉长转化周期。",
    "recommended_action": "提供清晰的新老款/版本差异对比与推荐逻辑（含 L6/LS6 取舍话术），并明确动力形式与上市排期的对外口径，减少用户观望。",
    "priority": "P2",
    "boundary": "四条 pattern 各为 1–2 店、单日定性自报；未量化决策周期延长对锁单率的影响，纯电排期为用户判断而非销量结论。",
    "status": "ready",
    "owner": "产品规划 / 销售运营",
    "created_at": "2026-10-02"
  },
  {
    "finding_id": "FND-0005",
    "title": "产品力与服务获正向认可，老用户口碑是未充分运营的资源",
    "statement": "多店反馈底盘与空间好评、LS6 受年轻家庭喜欢且性价比高、相同配置竞品价格更高、L6 联名款与外观获认可、用户只认宁德时代电池、试驾有助于击败竞品；同时出现主理热情、销售队伍成熟的正向评价，以及 LS9 Hyper 车主主动带朋友到店看车。",
    "pattern_ids": ["PAT-0002", "PAT-0009", "PAT-0013"],
    "convergence_ids": ["CONV-0002", "CONV-0009", "CONV-0013"],
    "issue_ids": ["ISS-0002", "ISS-0009", "ISS-0013"],
    "confidence": "low",
    "business_implication": "在价格观望与竞品对比的约束下，可被用户直接感知的产品、服务与老用户口碑是相对确定的抓手；老用户转介绍是尚未充分运营的忠诚度资源。",
    "recommended_action": "固化已验证的产品展示与服务话术为标准动作，并设计老用户转介绍机制（如国庆老带新试驾活动、老车主口碑传播）。",
    "priority": "P3",
    "boundary": "优势项 13 条证据跨 6 店，老用户 3 条跨 3 店，服务 3 条跨 3 店，均为单日定性自报；未与成交/锁单数据做归因。",
    "status": "ready",
    "owner": "销售运营 / 市场",
    "created_at": "2026-10-02"
  },
  {
    "finding_id": "FND-0006",
    "title": "品牌知名度较过往提升，价格与赠品权益预期仍影响短期转化",
    "statement": "万州快闪反馈智己品牌总体知名度较过往支持时已大幅提升，重庆南坪建议提升品牌曝光以吸引主动到店；同时贵阳商超店反馈进店客户询问价格且总想要赠品。品牌认知在改善，但价格与赠品权益预期仍存在。",
    "pattern_ids": ["PAT-0004", "PAT-0011"],
    "convergence_ids": ["CONV-0004", "CONV-0011"],
    "issue_ids": ["ISS-0004", "ISS-0011"],
    "confidence": "low",
    "business_implication": "品牌认知改善是可延续的趋势信号，但在下沉与商超场景，价格与赠品权益仍是短期转化的敏感点；缺少明确权益口径时用户容易持续观望。",
    "recommended_action": "延续品牌曝光投入并沉淀品牌认知改善素材；准备节日价格保护/权益与赠品口径的标准化应答，减少一线在价格与权益上的拉扯。",
    "priority": "P3",
    "boundary": "品牌 2 条证据跨 2 店，价格权益为单店单条；均为单日定性自报，未量化品牌认知或权益对转化的影响。",
    "status": "ready",
    "owner": "市场 / 品牌 / 销售运营",
    "created_at": "2026-10-02"
  }
]
