[
  {
    "finding_id": "FND-0001",
    "title": "国庆首日到店量受天气与门店形态主导，引流与转化动作成为关键",
    "statement": "国庆首日多店反馈降雨/降温抑制到店总量、附近友商普遍偏低，快闪/商超/地下商场型门店以路过与散步型客流为主、深度体验较少；与此同时一线在直播、异业联动、试驾赠饮与进店活动上给出较一致的运营诉求。",
    "pattern_ids": ["PAT-0002", "PAT-0011"],
    "convergence_ids": ["CONV-0002", "CONV-0011"],
    "issue_ids": ["ISS-0002", "ISS-0011"],
    "confidence": "low",
    "business_implication": "节日到店量受不可控的天气与大环境客流主导，单纯等客到店效率低；可感知的引流与体验动作，是把“路过型客流”转为“深度体验”的现实抓手。",
    "recommended_action": "汇总各店已提出且可复制的引流动作（直播、试驾赠饮、进店打卡、餐饮排队协同），按门店形态（快闪/商超/体验中心）给出差异化动作清单并评估投放。",
    "priority": "P2",
    "boundary": "证据来自 5 家门店的客流情境观察与 8 家门店的运营建议，均为单日定性自报；未验证各动作对进店/转化的实际效果。",
    "status": "ready",
    "owner": "销售运营 / 市场",
    "created_at": "2026-10-01"
  },
  {
    "finding_id": "FND-0002",
    "title": "品牌与技术品牌认知仍是到店与决策约束",
    "statement": "用户反馈对品牌不够熟悉、品牌知名度尚需提高，小城市客户更看重品牌力；同时用户对智驾供应商认知度不高，LS9 潜客更慎重考量上汽归属与 Momenta 背景。品牌与技术品牌信任共同构成认知约束。",
    "pattern_ids": ["PAT-0001", "PAT-0003"],
    "convergence_ids": ["CONV-0001", "CONV-0003"],
    "issue_ids": ["ISS-0001", "ISS-0003"],
    "confidence": "low",
    "business_implication": "在品牌力敏感市场，产品力强但品牌认知不足会限制到店与信任建立；技术品牌（智驾供应商、与上汽关系）的讲不清会削弱高阶配置的说服力。",
    "recommended_action": "补充品牌力与技术品牌的标准化沟通材料（含 Momenta 与上汽关系、智驾实力背书），并在下沉市场强化“名牌/性价比”叙事。",
    "priority": "P2",
    "boundary": "品牌 2 条证据跨 2 店，技术品牌 2 条证据跨 2 店、跨 LS6/LS9，均为单日定性自报；未量化品牌认知对到店或转化的影响。",
    "status": "ready",
    "owner": "市场 / 品牌 / 销售培训",
    "created_at": "2026-10-01"
  },
  {
    "finding_id": "FND-0003",
    "title": "价格与权益预期仍在抑制短期决策",
    "statement": "多组初次进店用户愿与销售深谈，但在价格和权益方面存在拉扯，用户表示考虑后再联系；价格与权益预期成为短期决策的抑制因素。",
    "pattern_ids": ["PAT-0004"],
    "convergence_ids": ["CONV-0004"],
    "issue_ids": ["ISS-0004"],
    "confidence": "low",
    "business_implication": "价格与权益的不确定性会拉长决策周期，在缺少明确权益口径时可能持续观望，影响国庆短期转化。",
    "recommended_action": "准备价格保护/权益对比话术与明确的节日权益沟通口径，帮助一线在“价格与权益拉扯”时快速给出一致答复。",
    "priority": "P2",
    "boundary": "单店单条专家观察、1 天；为价格态度信号，不等同于实际退单或流失；较 09/27 基线的证据覆盖收缩（2→1 条），仅反映本日 free-text 记录。",
    "status": "ready",
    "owner": "销售运营 / 市场",
    "created_at": "2026-10-01"
  },
  {
    "finding_id": "FND-0004",
    "title": "高意向客流与产品/服务优势明显，老用户口碑待运营",
    "statement": "交付中心高意向客流均试驾并锁单 LS8，用户对底盘与空间好评，LS6 提升潜客关注与座舱体验、高性价比与底盘获高认可、新款展车售空，门店团队训练有素；同时出现 LS7 老车主复购 LS9 并愿宣传、门店建议发动老带新的口碑机会。",
    "pattern_ids": ["PAT-0005", "PAT-0006"],
    "convergence_ids": ["CONV-0005", "CONV-0006"],
    "issue_ids": ["ISS-0005", "ISS-0006"],
    "confidence": "low",
    "business_implication": "在品牌认知与价格观望的约束下，可被用户直接感知的产品、座舱与服务体验是相对确定的抓手；老用户口碑与转介绍是尚未充分运营的忠诚度资源。",
    "recommended_action": "固化各店已验证的座舱展示与服务话术为标准动作，并设计老用户转介绍/口碑传播机制（如 KOL 老车主合作）。",
    "priority": "P3",
    "boundary": "优势项 11 条证据跨 7 店、跨 LS6/LS8，老用户 2 条证据跨 2 店，均为单日定性自报；未与成交/锁单数据做归因。",
    "status": "ready",
    "owner": "销售运营 / 市场",
    "created_at": "2026-10-01"
  },
  {
    "finding_id": "FND-0005",
    "title": "L6 区域适配与本地化沟通需针对性处理",
    "statement": "部分门店当日无客户关注 L6、无 L6 意向客户，且贵州地势促使当地客户对低底盘车辆拒购明显；同时非本地口音沟通让本地客户产生距离感、拒留资较多。反映 L6 在区域市场存在车型适配落差，且本地化沟通影响到店留资。",
    "pattern_ids": ["PAT-0010", "PAT-0012"],
    "convergence_ids": ["CONV-0010", "CONV-0012"],
    "issue_ids": ["ISS-0010", "ISS-0012"],
    "confidence": "low",
    "business_implication": "在特定地形与方言市场，车型定位（低底盘）与沟通方式可能同时压制到店与留资，若不区分区域做适配，会削弱 L6 与门店的转化效率。",
    "recommended_action": "梳理 L6 在低底盘敏感区域的产品沟通与替代推荐逻辑，并为方言明显市场配置本地化沟通资源或话术支持。",
    "priority": "P3",
    "boundary": "L6 适配 3 条证据跨 2 店（均在贵阳），本地化沟通为单店单条（遵义），均为单日定性自报；不能外推为总体车型结构或留资率结论。",
    "status": "ready",
    "owner": "产品规划 / 销售运营",
    "created_at": "2026-10-01"
  },
  {
    "finding_id": "FND-0006",
    "title": "竞品在车机、内饰质感与促销引流上形成可感知差距",
    "statement": "用户反馈竞品车机更好用、L6 内饰质感一般，并提到竞品赠送脚垫/头枕而智己未赠；另有门店观察到极氪与奶茶店合作「试驾送奶茶」。竞品在智能座舱、内饰质感与促销引流上形成可感知对标差距。",
    "pattern_ids": ["PAT-0007", "PAT-0008", "PAT-0009"],
    "convergence_ids": ["CONV-0007", "CONV-0008", "CONV-0009"],
    "issue_ids": ["ISS-0007", "ISS-0008", "ISS-0009"],
    "confidence": "low",
    "business_implication": "竞品体验与权益动作直接影响用户对比结论，若车机体验与促销权益不能在对比中交代清楚，可能在与竞品的最终比较中处于劣势。",
    "recommended_action": "整理车机与内饰的对标差异点用于一线应答；评估节日促销赠品/异业联动（试驾礼、异业合作）的可行性。",
    "priority": "P3",
    "boundary": "车机、内饰各为单店单条对标反馈，促销赠品/异业为 2 条证据跨 2 店，均为单日定性自报；未验证竞品动作与自身转化的直接关系。",
    "status": "ready",
    "owner": "产品市场 / 销售运营",
    "created_at": "2026-10-01"
  }
]
