[
  {
    "finding_id": "FND-0001",
    "title": "椭圆方向盘存在视线遮挡与拒购风险，建议优先评估整改",
    "statement": "在遵义门店，LS6/LS8 的椭圆方向盘被反馈严重遮挡视线（尤其电子后视镜），并有用户明确表达不喜欢与拒购风险；该造型可能直接抑制购买意愿。",
    "pattern_ids": ["PAT-0001"],
    "convergence_ids": ["CONV-0001"],
    "issue_ids": ["ISS-0001"],
    "confidence": "medium",
    "business_implication": "若该反馈具有普遍性，将影响 LS6/LS8 的到店转化；属于造型层面的高风险项。",
    "recommended_action": "在更多门店补充验证普遍性；评估电子后视镜画面位置可调与方向盘造型/尺寸调整方案。",
    "priority": "P2",
    "boundary": "仅 1 家门店、1 个记录时点、2 条证据。严重度按用户原话保留为 blocker，但证据宽度不足以支撑 P0/P1，故列 P2。",
    "status": "ready",
    "owner": "整车人机 / 产品体验研究",
    "created_at": "2026-09-11"
  },
  {
    "finding_id": "FND-0002",
    "title": "内饰豪华感与质感不足是跨车型、跨门店的系统性问题",
    "statement": "LS8/LS9 及部分 L6 用户持续反馈内饰不够高级、豪华感不足、配件质感与配色不佳，并在对比极氪 7X、小鹏 GX 时被强化；该问题跨 5 家门店、4 类对象复现，属系统性问题。",
    "pattern_ids": ["PAT-0003"],
    "convergence_ids": ["CONV-0003"],
    "issue_ids": ["ISS-0005", "ISS-0006", "ISS-0017", "ISS-0019"],
    "confidence": "high",
    "business_implication": "豪华定位与用户感知存在结构性落差，是竞品截流与价格接受度受损的重要来源。",
    "recommended_action": "建立内饰质感基线（用料、配色自由度、配件质感），将 LS8/LS9 内饰改款提升优先级，并提供更小众豪华的配色方案。",
    "priority": "P1",
    "boundary": "豪华感为定性主观感知，不等同于材料成本判断；样本为非随机门店反馈。",
    "status": "ready",
    "owner": "内饰设计 / 产品规划",
    "created_at": "2026-09-11"
  },
  {
    "finding_id": "FND-0003",
    "title": "配置减配感知削弱产品价值感",
    "statement": "慢充充电口无盖、L6 无电吸门、天窗不可开启透风、后排座椅手动放倒等被用户读作减配，在跨门店、跨车型中削弱价值感。",
    "pattern_ids": ["PAT-0008"],
    "convergence_ids": ["CONV-0008"],
    "issue_ids": ["ISS-0011"],
    "confidence": "medium",
    "business_implication": "价值感受损会降低定价接受度，并放大与竞品的配置对比劣势。",
    "recommended_action": "核对配置表确认是否实际减配；评估慢充口盖、电吸门、后排电动放倒等补齐或沟通方案。",
    "priority": "P1",
    "boundary": "当前仅反映用户感知，是否真为减配需与配置表核对。",
    "status": "ready",
    "owner": "产品规划",
    "created_at": "2026-09-11"
  },
  {
    "finding_id": "FND-0004",
    "title": "售后服务与智驾可信度是购前主要顾虑",
    "statement": "客户对 L6 满意但受售后服务（缺少取送车、既有用户负面口碑）影响而犹豫；同时用户质疑智驾硬件规格且普遍不了解供应商 momenta，智驾卖点可信度不足。",
    "pattern_ids": ["PAT-0009", "PAT-0010"],
    "convergence_ids": ["CONV-0009", "CONV-0010"],
    "issue_ids": ["ISS-0012", "ISS-0013"],
    "confidence": "medium",
    "business_implication": "售后与智驾可信度会直接转化为购前犹豫，抑制转化。",
    "recommended_action": "补齐并传播售后权益（如取送车）；以实测传播与供应商背书强化智驾可信度，弱化单一硬件线数叙事。",
    "priority": "P1",
    "boundary": "含门店侧二手口碑与 stated intent；智驾硬件线与实际体验的关系未在本数据中验证。",
    "status": "ready",
    "owner": "售后服务 / 智驾市场",
    "created_at": "2026-09-11"
  },
  {
    "finding_id": "FND-0005",
    "title": "储物与后排人体工程存在场景化痛点",
    "statement": "前备箱/前舱储物箱容量与开启方式、门板储物深度、后排乘坐与头部空间、LS8 六座二排大屏距离等在跨门店复现，影响家庭/长途/钓鱼等具体场景体验。",
    "pattern_ids": ["PAT-0002", "PAT-0007"],
    "convergence_ids": ["CONV-0002", "CONV-0007"],
    "issue_ids": ["ISS-0002", "ISS-0003", "ISS-0010", "ISS-0018"],
    "confidence": "medium",
    "business_implication": "特定使用场景体验受损，影响家庭用户口碑与复购推荐。",
    "recommended_action": "评估前舱储物容量与开启方式，优化二排大屏距离可调性（导轨），复核后排空间表现。",
    "priority": "P2",
    "boundary": "容量诉求带场景特异性，L6 空间与 LS8 大屏距离机制不同，仅在空间体验主题下合并。",
    "status": "ready",
    "owner": "产品设计",
    "created_at": "2026-09-11"
  },
  {
    "finding_id": "FND-0006",
    "title": "竞品对标暴露明确的便利配置差距与设计偏好",
    "statement": "对标小鹏 GX/N70/N90/小米等，LS9 在 B 柱扶手、三排 Type C、三排电动折叠、后排滑轨等家庭便利配置上存在差距；用户同时偏好半隐藏式门把手并关注 HUD。",
    "pattern_ids": ["PAT-0011"],
    "convergence_ids": ["CONV-0011"],
    "issue_ids": ["ISS-0014", "ISS-0015", "ISS-0016", "ISS-0028", "ISS-0029", "ISS-0030"],
    "confidence": "medium",
    "business_implication": "在家庭出行与便利性维度上对竞品失分，影响六座/七座目标人群决策。",
    "recommended_action": "形成 LS9 便利配置改款清单（B 柱扶手、三排 Type C、三排电动折叠、后排滑轨），并评估门把手与 HUD 偏好。",
    "priority": "P2",
    "boundary": "多为单店或单条对标观察，反映差距方向而非量化程度。",
    "status": "ready",
    "owner": "产品规划",
    "created_at": "2026-09-11"
  },
  {
    "finding_id": "FND-0007",
    "title": "品牌认知与门店渠道吸引力约束销售",
    "statement": "跨门店出现品牌认知度低、门店自然客流质量弱、竞品分流明显（小米/小鹏/零跑/阿维塔）等信号，构成销售端的系统性约束。",
    "pattern_ids": ["PAT-0013"],
    "convergence_ids": ["CONV-0013"],
    "issue_ids": ["ISS-0022", "ISS-0023"],
    "confidence": "medium",
    "business_implication": "获客质量与转化效率受限，单靠产品卖点难以完全弥补。",
    "recommended_action": "强化品牌与智驾背书传播，优化门店选址与导流，针对竞品分流制定话术与对标策略。",
    "priority": "P2",
    "boundary": "运营层证据，强依赖门店位置与区域市场，不可外推为全国判断。",
    "status": "ready",
    "owner": "市场 / 渠道",
    "created_at": "2026-09-11"
  },
  {
    "finding_id": "FND-0008",
    "title": "内饰锐角存在磕碰与划伤安全风险，建议整改",
    "statement": "主驾门内侧下沿尖角关门易磕小腿（新 LS6/L6 同风险），冰箱口内沿直角易划伤手背手指；友商已采用圆角加密封条的成熟方案。",
    "pattern_ids": ["PAT-0004"],
    "convergence_ids": ["CONV-0004"],
    "issue_ids": ["ISS-0007"],
    "confidence": "medium",
    "business_implication": "涉及人身安全与日常使用风险，可能引发投诉与口碑问题。",
    "recommended_action": "对门内侧下沿与冰箱口内沿实施圆角化，参考竞品增加密封条缓冲。",
    "priority": "P2",
    "boundary": "证据集中 1 店。涉及安全，建议不因证据宽度而降低处理紧迫度；但按评审规则 P0/P1 需 moderate 以上证据，故列 P2 并单列安全复核。",
    "status": "ready",
    "owner": "工程质量",
    "created_at": "2026-09-11"
  },
  {
    "finding_id": "FND-0009",
    "title": "智能座舱语音与 NVH 细节需优化",
    "statement": "IMClaw 在多音字、场景推荐与指令区分上表现不稳定；L6 的 BO 音响调校与 19 寸佳通 P10 胎噪也被明确反馈。",
    "pattern_ids": ["PAT-0005", "PAT-0006"],
    "convergence_ids": ["CONV-0005", "CONV-0006"],
    "issue_ids": ["ISS-0004", "ISS-0008", "ISS-0009"],
    "confidence": "low",
    "business_implication": "智能座舱与 NVH 细节影响整车高级感与试驾口碑。",
    "recommended_action": "优化 IMClaw 方言/多音字识别与指令程度区分；评估音响调校与轮胎选型。",
    "priority": "P3",
    "boundary": "证据集中在单店，音响与胎噪含主观成分，胎噪未控制路面/车速条件。",
    "status": "ready",
    "owner": "智能座舱 / NVH",
    "created_at": "2026-09-11"
  },
  {
    "finding_id": "FND-0010",
    "title": "驾驶卖点传达受损（后轮转向/线控）",
    "statement": "新款 L6 后轮转向被店长反馈不如老款，LS6 线控转向无法试驾，导致核心驾驶卖点既未被有效体验，又出现改款倒退感知。",
    "pattern_ids": ["PAT-0012"],
    "convergence_ids": ["CONV-0012"],
    "issue_ids": ["ISS-0020", "ISS-0021"],
    "confidence": "low",
    "business_implication": "驾驶技术卖点未被用户感知，营销投入难以转化为到店体验。",
    "recommended_action": "开放 LS6 线控转向试驾；复核新款 L6 后轮转向标定与老款差异。",
    "priority": "P3",
    "boundary": "以店长主观反馈为主，缺少对比试驾的量化数据。",
    "status": "ready",
    "owner": "底盘",
    "created_at": "2026-09-11"
  },
  {
    "finding_id": "FND-0011",
    "title": "已验证的产品与服务优势项应保留并放大",
    "statement": "雨天 LS6 辅助驾驶表现、LS8 对年长及区域实力用户的适配、门店接待服务均获正面验证，是可利用的差异化资产。",
    "pattern_ids": ["PAT-0015"],
    "convergence_ids": ["CONV-0015"],
    "issue_ids": ["ISS-0025", "ISS-0026", "ISS-0027"],
    "confidence": "medium",
    "business_implication": "正面资产可用于对冲竞品对比与品牌认知不足。",
    "recommended_action": "将雨天智驾实测、LS8 区域/人群策略与门店服务体验纳入营销素材与区域运营。",
    "priority": "P3",
    "boundary": "正面证据条数少且分散，作为定性优势信号，不代表满意度评分。",
    "status": "ready",
    "owner": "市场",
    "created_at": "2026-09-11"
  },
  {
    "finding_id": "FND-0012",
    "title": "用户观望等待新款影响短期转化节奏",
    "statement": "用户不愿买老款 LS6、未抢到前 1000 台，并在新款 L6 与尚未发布的新款 LS6 之间犹豫，形成短期锁单抑制。",
    "pattern_ids": ["PAT-0014"],
    "convergence_ids": ["CONV-0014"],
    "issue_ids": ["ISS-0024"],
    "confidence": "low",
    "business_implication": "短期转化节奏受新款预期与配额机制影响。",
    "recommended_action": "管理配额沟通与老款/新款过渡节奏，减少用户无限期观望。",
    "priority": "P3",
    "boundary": "单店单时点的时间性现象，可能随新款发布消退。",
    "status": "ready",
    "owner": "销售",
    "created_at": "2026-09-11"
  }
]
